<?xml version="1.0" encoding="UTF-8"?>
<!ELEMENT direccion (nombrecompleto, correo, telefono, cumple)>
<!ELEMENT nombrecompleto (nombre, apellidos)>
<!ELEMENT nombre (#PCDATA)>
<!ELEMENT apellidos (#PCDATA)>
<!ELEMENT correo (#PCDATA)>
<!ELEMENT telefono (#PCDATA)>
<!ELEMENT cumple (dia, mes ,anio)>
<!ELEMENT dia (#PCDATA)>
<!ELEMENT mes (#PCDATA)>
<!ELEMENT anio (#PCDATA)>